{
  "schema": "vave-discovery/1",
  "exportedAt": "2026-09-28T12:06:11.000Z",
  "startedAt": "2026-09-28T12:00:02.000Z",
  "respondent": "Beispiel (nicht echt)",
  "sort": {
    "kalender": "drop",
    "zeit": "keep",
    "kontakte": "keep",
    "korrespondenz": "unknown",
    "bizdev": "drop",
    "suche": "keep",
    "pm": "keep",
    "ressourcen": "keep",
    "media": "drop",
    "angebote": "keep",
    "controlling": "keep",
    "op": "keep",
    "liquiditaet": "unknown",
    "fibu": "keep",
    "ocr": "keep",
    "retainer": "keep",
    "wkl": "drop",
    "preislisten": "unknown",
    "kassenbuch": "drop",
    "mandanten": "keep",
    "waehrung": "keep",
    "sprachen": "keep",
    "hr": "unknown",
    "app": "keep",
    "exchange": "drop",
    "mail": "unknown",
    "api": "keep",
    "export": "keep"
  },
  "friction": {
    "zeit": 4,
    "kontakte": 1,
    "suche": 3,
    "pm": 4,
    "ressourcen": 3,
    "angebote": 2,
    "controlling": 2,
    "op": 0,
    "fibu": 0,
    "ocr": 1,
    "retainer": 1,
    "mandanten": 1,
    "waehrung": 0,
    "sprachen": 2,
    "app": 4,
    "api": 3,
    "export": 1
  },
  "wishes": {
    "budget-ampel": "must",
    "zeit-5s": "must",
    "ki-belege": "nice",
    "onboarding": "must",
    "kapazitaet": "must",
    "forecast": "nice",
    "dashboards": "nice",
    "slack-teams": "off",
    "kundenportal": "nice",
    "en-zh": "must",
    "auto-rechnung": "off",
    "offene-api": "nice",
    "schnell": "must",
    "preis-pro-kopf": "off"
  },
  "customWishes": [
    {
      "id": "custom-example1",
      "text": "Projektstatus für Kunden in Shanghai ohne VPN sichtbar",
      "level": "nice"
    }
  ],
  "roles": {
    "gf": "weekly",
    "pm": "daily",
    "kreation": "daily",
    "tech": "weekly",
    "finanzen": "daily",
    "asia": "daily",
    "freelancer": "rarely"
  },
  "budget": {
    "current": 1700,
    "currentUnknown": false,
    "max": 2200,
    "buildBuy": 55
  },
  "wand": "Zeit buchen darf nicht länger dauern als die Arbeit, die ich buche.",
  "noGo": "Die Buchhaltung darf nicht drei Monate stillstehen.",
  "hypothesis": {
    "target": "A",
    "reasons": [
      "Beispieldatei — Begründungen erzeugt die Umfrage selbst."
    ]
  }
}
